{"schemaVersion":1,"id":"org.hackeros.commands.ausearch","name":"ausearch","version":"1.0.0","publisherId":"pub.hackeros","description":"Search the filesystem audit log","kind":"terminal","entryPoint":{"assembly":"HackerOs.Commands.dll","type":"HackerOs.Commands.Ausearch.AusearchCommand"},"sdkCompatibility":{"minimumVersion":"2.1.0"},"presentation":{"category":"utilities","launchVisibility":"hidden","iconAssetPaths":[]},"localizations":[{"culture":"fr","resourcePath":"localization/org.hackeros.commands.ausearch/fr.json"}],"capabilities":["filesystem.system.read","filesystem.user-home.read"],"declaredTopicPermissions":[],"resources":{"baselineCpuWeight":0,"burstCpuWeight":0.01,"baselineMemoryWeight":0.01,"burstMemoryWeight":0.02,"baselineStorageIoWeight":0,"burstStorageIoWeight":0,"baselineNetworkIoWeight":0,"burstNetworkIoWeight":0},"intents":[],"dependencies":[],"assets":[],"fileHandlers":[],"terminal":{"name":"ausearch","aliases":[],"usage":"ausearch [-f path] [-ua user] [-c comm] [--success yes|no] [-if file]"},"singleInstancePerUser":false,"autoStart":false,"supportsBack":false,"execution":"pool"}
