{"schemaVersion":1,"id":"org.hackeros.commands.df","name":"df","version":"1.0.0","publisherId":"pub.hackeros","description":"Report file system disk space usage","kind":"terminal","entryPoint":{"assembly":"HackerOs.Commands.dll","type":"HackerOs.Commands.Df.DfCommand"},"sdkCompatibility":{"minimumVersion":"2.1.0"},"presentation":{"category":"utilities","launchVisibility":"hidden","iconAssetPaths":[]},"localizations":[{"culture":"fr","resourcePath":"localization/org.hackeros.commands.df/fr.json"}],"capabilities":["filesystem.system.read"],"declaredTopicPermissions":[],"resources":{"baselineCpuWeight":0,"burstCpuWeight":0.01,"baselineMemoryWeight":0.01,"burstMemoryWeight":0.02,"baselineStorageIoWeight":0,"burstStorageIoWeight":0,"baselineNetworkIoWeight":0,"burstNetworkIoWeight":0},"intents":[],"dependencies":[],"assets":[],"fileHandlers":[],"terminal":{"name":"df","aliases":[],"usage":"df [-h] [-k] [-T] [-i]"},"singleInstancePerUser":false,"autoStart":false,"supportsBack":false,"execution":"pool"}
