{"schemaVersion":1,"id":"org.hackeros.commands.alias","name":"alias","version":"1.0.0","publisherId":"pub.hackeros","description":"Define or display command aliases","kind":"terminal","entryPoint":{"assembly":"HackerOs.Commands.dll","type":"HackerOs.Commands.Alias.AliasCommand"},"sdkCompatibility":{"minimumVersion":"2.2.0"},"presentation":{"category":"utilities","launchVisibility":"hidden","iconAssetPaths":[]},"localizations":[{"culture":"fr","resourcePath":"localization/org.hackeros.commands.alias/fr.json"}],"capabilities":["filesystem.user-home.read","filesystem.user-home.write"],"declaredTopicPermissions":[],"resources":{"baselineCpuWeight":0,"burstCpuWeight":0.01,"baselineMemoryWeight":0,"burstMemoryWeight":0.01,"baselineStorageIoWeight":0,"burstStorageIoWeight":0,"baselineNetworkIoWeight":0,"burstNetworkIoWeight":0},"intents":[],"dependencies":[],"assets":[],"fileHandlers":[],"terminal":{"name":"alias","aliases":["addalias","rmalias","unalias"],"usage":"alias [name[=value]]"},"singleInstancePerUser":false,"autoStart":false,"supportsBack":false,"execution":"pool"}
