{"schemaVersion":1,"id":"org.hackeros.commands.ping","name":"ping","version":"1.0.0","publisherId":"pub.hackeros","description":"Simulated network ping command \u2014 tests reachability of a simulated host","kind":"terminal","entryPoint":{"assembly":"HackerOs.Commands.dll","type":"HackerOs.Commands.Ping.PingCommand"},"sdkCompatibility":{"minimumVersion":"2.1.0"},"presentation":{"category":"network","launchVisibility":"hidden","iconAssetPaths":[]},"localizations":[{"culture":"fr","resourcePath":"localization/org.hackeros.commands.ping/fr.json"}],"capabilities":["network.real.access","network.simulated.read"],"declaredTopicPermissions":[],"resources":{"baselineCpuWeight":0.01,"burstCpuWeight":0.05,"baselineMemoryWeight":0.01,"burstMemoryWeight":0.05,"baselineStorageIoWeight":0,"burstStorageIoWeight":0,"baselineNetworkIoWeight":0,"burstNetworkIoWeight":0},"intents":[],"dependencies":[],"assets":[],"fileHandlers":[],"terminal":{"name":"ping","aliases":[],"usage":"ping \u003Chostname|ip\u003E"},"singleInstancePerUser":false,"autoStart":false,"supportsBack":false,"execution":"pool"}
