{"schemaVersion":1,"id":"org.hackeros.commands.cp","name":"cp","version":"1.0.0","publisherId":"pub.hackeros","description":"Copy files and directories","kind":"terminal","entryPoint":{"assembly":"HackerOs.Commands.dll","type":"HackerOs.Commands.Cp.CpCommand"},"sdkCompatibility":{"minimumVersion":"2.2.0"},"presentation":{"category":"utilities","launchVisibility":"hidden","iconAssetPaths":[]},"localizations":[{"culture":"fr","resourcePath":"localization/org.hackeros.commands.cp/fr.json"}],"capabilities":["filesystem.system.read","filesystem.system.write","filesystem.user-home.read","filesystem.user-home.write"],"declaredTopicPermissions":[],"resources":{"baselineCpuWeight":0.01,"burstCpuWeight":0.05,"baselineMemoryWeight":0.01,"burstMemoryWeight":0.05,"baselineStorageIoWeight":0.05,"burstStorageIoWeight":0.2,"baselineNetworkIoWeight":0,"burstNetworkIoWeight":0},"intents":[],"dependencies":[],"assets":[],"fileHandlers":[],"terminal":{"name":"cp","aliases":[],"usage":"cp [-r|-R] \u003Csource...\u003E \u003Cdestination\u003E"},"singleInstancePerUser":false,"autoStart":false,"supportsBack":false,"execution":"pool"}
