{"schemaVersion":1,"id":"org.hackeros.commands.netstat","name":"netstat","version":"1.0.0","publisherId":"pub.hackeros","description":"Print network connections, routing tables and interface statistics","kind":"terminal","entryPoint":{"assembly":"HackerOs.Commands.dll","type":"HackerOs.Commands.Netstat.NetstatCommand"},"sdkCompatibility":{"minimumVersion":"2.2.0"},"presentation":{"category":"utilities","launchVisibility":"hidden","iconAssetPaths":[]},"localizations":[{"culture":"fr","resourcePath":"localization/org.hackeros.commands.netstat/fr.json"}],"capabilities":["filesystem.system.read","network.simulated.read","network.simulated.write","process.list"],"declaredTopicPermissions":[],"resources":{"baselineCpuWeight":0,"burstCpuWeight":0.01,"baselineMemoryWeight":0.01,"burstMemoryWeight":0.02,"baselineStorageIoWeight":0,"burstStorageIoWeight":0,"baselineNetworkIoWeight":0,"burstNetworkIoWeight":0},"intents":[],"dependencies":[],"assets":[],"fileHandlers":[],"terminal":{"name":"netstat","aliases":["ss"],"usage":"netstat [-tulnap] [-i] [-r] [-s]"},"singleInstancePerUser":false,"autoStart":false,"supportsBack":false,"execution":"pool"}
