{"schemaVersion":1,"id":"org.hackeros.commands.launch","name":"launch","version":"1.0.0","publisherId":"pub.hackeros","description":"Launch an application by ID","kind":"terminal","entryPoint":{"assembly":"HackerOs.Commands.dll","type":"HackerOs.Commands.Launch.LaunchCommand"},"sdkCompatibility":{"minimumVersion":"2.1.0"},"presentation":{"category":"utilities","launchVisibility":"hidden","iconAssetPaths":[]},"localizations":[{"culture":"fr","resourcePath":"localization/org.hackeros.commands.launch/fr.json"}],"capabilities":["apps.launch"],"declaredTopicPermissions":[],"resources":{"baselineCpuWeight":0.01,"burstCpuWeight":0.05,"baselineMemoryWeight":0.01,"burstMemoryWeight":0.05,"baselineStorageIoWeight":0,"burstStorageIoWeight":0,"baselineNetworkIoWeight":0,"burstNetworkIoWeight":0},"intents":[],"dependencies":[],"assets":[],"fileHandlers":[],"terminal":{"name":"launch","aliases":[],"usage":"launch \u003Capp-id\u003E"},"singleInstancePerUser":false,"autoStart":false,"supportsBack":false,"execution":"pool"}
