{"schemaVersion":1,"id":"org.hackeros.hackwebd","name":"hackwebd","version":"1.0.0","publisherId":"pub.hackeros","description":"HackerOS web server: serves the static sites declared in /etc/hackweb/sites and ~/.config/hackweb/sites","kind":"service","entryPoint":{"assembly":"HackerOs.Apps.WebServer.dll","type":"HackerOs.Apps.WebServer.Daemon.HackWebdService"},"sdkCompatibility":{"minimumVersion":"2.2.0"},"presentation":{"category":"system","launchVisibility":"hidden","iconAssetPaths":[]},"localizations":[{"culture":"fr","resourcePath":"localization/org.hackeros.hackwebd/fr.json"}],"capabilities":["filesystem.system.read","filesystem.user-home.read","filesystem.user-home.write","network.listen","network.listen.privileged"],"declaredTopicPermissions":[],"resources":{"baselineCpuWeight":0.01,"burstCpuWeight":0.1,"baselineMemoryWeight":0.02,"burstMemoryWeight":0.08,"baselineStorageIoWeight":0.01,"burstStorageIoWeight":0.2,"baselineNetworkIoWeight":0.01,"burstNetworkIoWeight":0.2},"intents":[],"dependencies":[],"assets":[],"fileHandlers":[],"singleInstancePerUser":true,"autoStart":true,"supportsBack":false,"execution":"dedicated"}
