{"schemaVersion":1,"id":"org.hackeros.settings","name":"Settings","version":"1.0.0","publisherId":"pub.hackeros","description":"System control panel for user preferences, appearance, language, file associations, capabilities, backup, and device configuration","kind":"window","platform":{"supported":["desktop","mobile"],"entryPoints":[{"platforms":["desktop","mobile"],"assembly":"HackerOs.Apps.Settings.dll","type":"HackerOs.Apps.Settings.SettingsWindow"}]},"sdkCompatibility":{"minimumVersion":"2.2.0"},"presentation":{"category":"system","launchVisibility":"visible","iconAssetPaths":["icons/app.svg"]},"localizations":[{"culture":"fr","resourcePath":"localization/org.hackeros.settings/fr.json"}],"capabilities":["apps.launch","apps.manage","file-associations.read","file-associations.write","filesystem.system.read","filesystem.system.write","filesystem.user-home.read","filesystem.user-home.write","permissions.manage","process.list","screens.manage","server.connection.manage","services.manage","system.backup","system.power","users.manage"],"declaredTopicPermissions":[],"resources":{"baselineCpuWeight":0.02,"burstCpuWeight":0.1,"baselineMemoryWeight":0.05,"burstMemoryWeight":0.1,"baselineStorageIoWeight":0,"burstStorageIoWeight":0,"baselineNetworkIoWeight":0,"burstNetworkIoWeight":0},"intents":[],"dependencies":[],"assets":[{"path":"icons/app.svg","kind":"image","sha256":"7490ce968fa4c74928fccff9521c78e6586d26bc1a705c5ab1be7289dd011a9f","role":"app-icon"}],"fileHandlers":[],"singleInstancePerUser":true,"autoStart":false,"supportsBack":false,"execution":"mainThread"}
