{"schemaVersion":1,"id":"org.hackeros.commands.nice","name":"nice","version":"1.0.0","publisherId":"pub.hackeros","description":"Run a command with modified scheduling priority","kind":"terminal","entryPoint":{"assembly":"HackerOs.Commands.dll","type":"HackerOs.Commands.Nice.NiceCommand"},"sdkCompatibility":{"minimumVersion":"2.2.0"},"presentation":{"category":"utilities","launchVisibility":"hidden","iconAssetPaths":[]},"localizations":[{"culture":"fr","resourcePath":"localization/org.hackeros.commands.nice/fr.json"}],"capabilities":["shell.control"],"declaredTopicPermissions":[],"resources":{"baselineCpuWeight":0,"burstCpuWeight":0.01,"baselineMemoryWeight":0,"burstMemoryWeight":0.01,"baselineStorageIoWeight":0,"burstStorageIoWeight":0,"baselineNetworkIoWeight":0,"burstNetworkIoWeight":0},"intents":[],"dependencies":[],"assets":[],"fileHandlers":[],"terminal":{"name":"nice","aliases":[],"usage":"nice [-n N] [command [args...]]"},"singleInstancePerUser":false,"autoStart":false,"supportsBack":false,"execution":"mainThread"}
