{"schemaVersion":1,"id":"org.hackeros.web-server-manager","name":"Web Server Manager","version":"1.0.0","publisherId":"pub.hackeros","description":"Publish folders as web sites and manage the hackwebd web server","kind":"window","platform":{"supported":["desktop","mobile"],"entryPoints":[{"platforms":["desktop","mobile"],"assembly":"HackerOs.Apps.WebServer.dll","type":"HackerOs.Apps.WebServer.Manager.WebServerManagerWindow"}]},"sdkCompatibility":{"minimumVersion":"2.2.0"},"presentation":{"category":"system","launchVisibility":"visible","iconAssetPaths":["icons/app.svg"]},"localizations":[{"culture":"fr","resourcePath":"localization/org.hackeros.web-server-manager/fr.json"}],"capabilities":["apps.launch","dialogs.folder-select","filesystem.system.read","filesystem.system.write","filesystem.user-home.read","filesystem.user-home.write","notifications.post","process.list","shell.context-menu"],"declaredTopicPermissions":[],"resources":{"baselineCpuWeight":0.02,"burstCpuWeight":0.1,"baselineMemoryWeight":0.04,"burstMemoryWeight":0.1,"baselineStorageIoWeight":0,"burstStorageIoWeight":0.05,"baselineNetworkIoWeight":0,"burstNetworkIoWeight":0},"intents":[{"intentId":"org.hackeros.web-server-manager.publish-site.v1"}],"dependencies":[],"assets":[{"path":"icons/app.svg","kind":"image","sha256":"59e844a182c6f195c4a3e574c4954d939c2fb5172c68275f131facc929680f88","role":"app-icon"}],"fileHandlers":[],"contextMenus":[{"name":"publish-site","title":"Menu.PublishSite","titles":[{"culture":"en","text":"Publish as a web site\u2026"},{"culture":"fr","text":"Publier comme site web\u2026"}],"target":"self","intent":"org.hackeros.web-server-manager.publish-site.v1","icon":{"kind":"vector","source":"globe","library":"lucide"},"scopes":["directory"],"selection":"single","first":false}],"singleInstancePerUser":true,"autoStart":false,"supportsBack":false,"execution":"mainThread"}
