{"schemaVersion":1,"id":"org.hackeros.commands.xdg-open","name":"xdg-open","version":"1.0.0","publisherId":"pub.hackeros","description":"Open a file, folder or URI in the user\u0027s preferred application","kind":"terminal","entryPoint":{"assembly":"HackerOs.Commands.dll","type":"HackerOs.Commands.XdgOpen.XdgOpenCommand"},"sdkCompatibility":{"minimumVersion":"2.2.0"},"presentation":{"category":"utilities","launchVisibility":"hidden","iconAssetPaths":[]},"localizations":[{"culture":"fr","resourcePath":"localization/org.hackeros.commands.xdg-open/fr.json"}],"capabilities":["apps.launch","filesystem.system.read","filesystem.user-home.read"],"declaredTopicPermissions":[],"resources":{"baselineCpuWeight":0.01,"burstCpuWeight":0.05,"baselineMemoryWeight":0.01,"burstMemoryWeight":0.05,"baselineStorageIoWeight":0,"burstStorageIoWeight":0,"baselineNetworkIoWeight":0,"burstNetworkIoWeight":0},"intents":[],"dependencies":[],"assets":[],"fileHandlers":[],"terminal":{"name":"xdg-open","aliases":[],"usage":"xdg-open \u003Cfile|folder|URI\u003E"},"singleInstancePerUser":false,"autoStart":false,"supportsBack":false,"execution":"pool"}
