{"schemaVersion":1,"id":"org.hackeros.commands.kill","name":"kill","version":"1.0.0","publisherId":"pub.hackeros","description":"Send a signal to a process or terminate it","kind":"terminal","entryPoint":{"assembly":"HackerOs.Commands.dll","type":"HackerOs.Commands.Kill.KillCommand"},"sdkCompatibility":{"minimumVersion":"2.1.0"},"presentation":{"category":"utilities","launchVisibility":"hidden","iconAssetPaths":[]},"localizations":[{"culture":"fr","resourcePath":"localization/org.hackeros.commands.kill/fr.json"}],"capabilities":["process.manage","shell.control"],"declaredTopicPermissions":[],"resources":{"baselineCpuWeight":0.01,"burstCpuWeight":0.05,"baselineMemoryWeight":0.01,"burstMemoryWeight":0.05,"baselineStorageIoWeight":0,"burstStorageIoWeight":0,"baselineNetworkIoWeight":0,"burstNetworkIoWeight":0},"intents":[],"dependencies":[],"assets":[],"fileHandlers":[],"terminal":{"name":"kill","aliases":[],"usage":"kill [-s sig | -SIG] \u003Cpid|%job...\u003E | kill -l"},"singleInstancePerUser":false,"autoStart":false,"supportsBack":false,"execution":"mainThread"}
