{"schemaVersion":1,"id":"org.hackeros.commands.systemctl","name":"systemctl","version":"1.0.0","publisherId":"pub.hackeros","description":"Query and control the system services","kind":"terminal","entryPoint":{"assembly":"HackerOs.Commands.dll","type":"HackerOs.Commands.Systemctl.SystemctlCommand"},"sdkCompatibility":{"minimumVersion":"2.2.0"},"presentation":{"category":"utilities","launchVisibility":"hidden","iconAssetPaths":[]},"localizations":[{"culture":"fr","resourcePath":"localization/org.hackeros.commands.systemctl/fr.json"}],"capabilities":["filesystem.system.read","process.list","services.manage"],"declaredTopicPermissions":[],"resources":{"baselineCpuWeight":0,"burstCpuWeight":0.01,"baselineMemoryWeight":0.01,"burstMemoryWeight":0.02,"baselineStorageIoWeight":0,"burstStorageIoWeight":0,"baselineNetworkIoWeight":0,"burstNetworkIoWeight":0},"intents":[],"dependencies":[],"assets":[],"fileHandlers":[],"terminal":{"name":"systemctl","aliases":["service"],"usage":"systemctl [list-units|status|start|stop|restart|enable|disable|is-active|is-enabled] [service...]"},"singleInstancePerUser":false,"autoStart":false,"supportsBack":false,"execution":"pool"}
