{"schemaVersion":1,"id":"org.hackeros.commands.locate","name":"locate","version":"1.0.0","publisherId":"pub.hackeros","description":"Find files by name anywhere in the filesystem","kind":"terminal","entryPoint":{"assembly":"HackerOs.Commands.dll","type":"HackerOs.Commands.Locate.LocateCommand"},"sdkCompatibility":{"minimumVersion":"2.2.0"},"presentation":{"category":"utilities","launchVisibility":"hidden","iconAssetPaths":[]},"localizations":[{"culture":"fr","resourcePath":"localization/org.hackeros.commands.locate/fr.json"}],"capabilities":["filesystem.system.read","filesystem.user-home.read"],"declaredTopicPermissions":[],"resources":{"baselineCpuWeight":0.01,"burstCpuWeight":0.1,"baselineMemoryWeight":0.01,"burstMemoryWeight":0.08,"baselineStorageIoWeight":0.05,"burstStorageIoWeight":0.5,"baselineNetworkIoWeight":0,"burstNetworkIoWeight":0},"intents":[],"dependencies":[],"assets":[],"fileHandlers":[],"terminal":{"name":"locate","aliases":[],"usage":"locate [-i] [-b] [-c] [-l count] pattern..."},"singleInstancePerUser":false,"autoStart":false,"supportsBack":false,"execution":"pool"}
