{"schemaVersion":1,"id":"org.hackeros.commands.chmod","name":"chmod","version":"1.0.0","publisherId":"pub.hackeros","description":"Change file permissions mode bits","kind":"terminal","entryPoint":{"assembly":"HackerOs.Commands.dll","type":"HackerOs.Commands.Chmod.ChmodCommand"},"sdkCompatibility":{"minimumVersion":"2.1.0"},"presentation":{"category":"utilities","launchVisibility":"hidden","iconAssetPaths":[]},"localizations":[{"culture":"fr","resourcePath":"localization/org.hackeros.commands.chmod/fr.json"}],"capabilities":["filesystem.system.read","filesystem.system.write","filesystem.user-home.read","filesystem.user-home.write"],"declaredTopicPermissions":[],"resources":{"baselineCpuWeight":0.01,"burstCpuWeight":0.05,"baselineMemoryWeight":0.01,"burstMemoryWeight":0.05,"baselineStorageIoWeight":0.05,"burstStorageIoWeight":0.2,"baselineNetworkIoWeight":0,"burstNetworkIoWeight":0},"intents":[],"dependencies":[],"assets":[],"fileHandlers":[],"terminal":{"name":"chmod","aliases":[],"usage":"chmod [-Rvcf] \u003Cmode\u003E \u003Cfile...\u003E   (mode: 755, \u002Bx, u\u002Bx, go-w, a=r, ...)"},"singleInstancePerUser":false,"autoStart":false,"supportsBack":false,"execution":"pool"}
