{"schemaVersion":1,"id":"org.hackeros.commands.true","name":"true","version":"1.0.0","publisherId":"pub.hackeros","description":"Do nothing, successfully","kind":"terminal","entryPoint":{"assembly":"HackerOs.Commands.dll","type":"HackerOs.Commands.True.TrueCommand"},"sdkCompatibility":{"minimumVersion":"2.2.0"},"presentation":{"category":"utilities","launchVisibility":"hidden","iconAssetPaths":[]},"localizations":[{"culture":"fr","resourcePath":"localization/org.hackeros.commands.true/fr.json"}],"capabilities":[],"declaredTopicPermissions":[],"resources":{"baselineCpuWeight":0,"burstCpuWeight":0.01,"baselineMemoryWeight":0.01,"burstMemoryWeight":0.02,"baselineStorageIoWeight":0,"burstStorageIoWeight":0,"baselineNetworkIoWeight":0,"burstNetworkIoWeight":0},"intents":[],"dependencies":[],"assets":[],"fileHandlers":[],"terminal":{"name":"true","aliases":[],"usage":"true"},"singleInstancePerUser":false,"autoStart":false,"supportsBack":false,"execution":"pool"}
