{"schemaVersion":1,"id":"org.hackeros.cmd.pwd","name":"pwd","version":"1.0.0","publisherId":"pub.hackeros","description":"Print name of current/working directory","kind":"terminal","entryPoint":{"assembly":"HackerOs.Commands.dll","type":"HackerOs.Commands.Pwd.PwdCommand"},"sdkCompatibility":{"minimumVersion":"2.1.0"},"presentation":{"category":"utilities","launchVisibility":"hidden","iconAssetPaths":[]},"localizations":[{"culture":"fr","resourcePath":"localization/org.hackeros.cmd.pwd/fr.json"}],"capabilities":[],"declaredTopicPermissions":[],"resources":{"baselineCpuWeight":0.01,"burstCpuWeight":0.05,"baselineMemoryWeight":0.01,"burstMemoryWeight":0.05,"baselineStorageIoWeight":0,"burstStorageIoWeight":0,"baselineNetworkIoWeight":0,"burstNetworkIoWeight":0},"intents":[],"dependencies":[],"assets":[],"fileHandlers":[],"terminal":{"name":"pwd","aliases":[],"usage":"pwd"},"singleInstancePerUser":false,"autoStart":false,"supportsBack":false,"execution":"pool"}
