{"schemaVersion":1,"id":"org.hackeros.commands.prlimit","name":"prlimit","version":"1.0.0","publisherId":"pub.hackeros","description":"Get and set the resource limits of a process","kind":"terminal","entryPoint":{"assembly":"HackerOs.Commands.dll","type":"HackerOs.Commands.Prlimit.PrlimitCommand"},"sdkCompatibility":{"minimumVersion":"2.1.0"},"presentation":{"category":"utilities","launchVisibility":"hidden","iconAssetPaths":[]},"localizations":[{"culture":"fr","resourcePath":"localization/org.hackeros.commands.prlimit/fr.json"}],"capabilities":["filesystem.system.read","process.list","process.manage"],"declaredTopicPermissions":[],"resources":{"baselineCpuWeight":0.01,"burstCpuWeight":0.05,"baselineMemoryWeight":0.01,"burstMemoryWeight":0.05,"baselineStorageIoWeight":0,"burstStorageIoWeight":0,"baselineNetworkIoWeight":0,"burstNetworkIoWeight":0},"intents":[],"dependencies":[],"assets":[],"fileHandlers":[],"terminal":{"name":"prlimit","aliases":[],"usage":"prlimit [--pid \u003Cpid\u003E] [--cpu[=soft:hard]] [--rss[=]] [--nofile[=]] [--nproc[=]] [--noheadings]"},"singleInstancePerUser":false,"autoStart":false,"supportsBack":false,"execution":"pool"}
