{"schemaVersion":1,"id":"org.hackeros.commands.localectl","name":"localectl","version":"1.0.0","publisherId":"pub.hackeros","description":"Query or change the system locale","kind":"terminal","entryPoint":{"assembly":"HackerOs.Commands.dll","type":"HackerOs.Commands.Localectl.LocalectlCommand"},"sdkCompatibility":{"minimumVersion":"2.1.0"},"presentation":{"category":"utilities","launchVisibility":"hidden","iconAssetPaths":[]},"localizations":[{"culture":"fr","resourcePath":"localization/org.hackeros.commands.localectl/fr.json"}],"capabilities":["filesystem.system.read","filesystem.system.write"],"declaredTopicPermissions":[],"resources":{"baselineCpuWeight":0,"burstCpuWeight":0.01,"baselineMemoryWeight":0,"burstMemoryWeight":0.01,"baselineStorageIoWeight":0,"burstStorageIoWeight":0.01,"baselineNetworkIoWeight":0,"burstNetworkIoWeight":0},"intents":[],"dependencies":[],"assets":[],"fileHandlers":[],"terminal":{"name":"localectl","aliases":[],"usage":"localectl [status | list-locales | set-locale VARIABLE=LOCALE...]"},"singleInstancePerUser":false,"autoStart":false,"supportsBack":false,"execution":"pool"}
