{"schemaVersion":1,"id":"org.hackeros.commands.hackpkg","name":"hackpkg","version":"1.0.0","publisherId":"pub.hackeros","description":"Install, update and remove apps from their GitHub repository","kind":"terminal","entryPoint":{"assembly":"HackerOs.Commands.dll","type":"HackerOs.Commands.Hackpkg.HackpkgCommand"},"sdkCompatibility":{"minimumVersion":"2.1.0"},"presentation":{"category":"utilities","launchVisibility":"hidden","iconAssetPaths":[]},"localizations":[{"culture":"fr","resourcePath":"localization/org.hackeros.commands.hackpkg/fr.json"}],"capabilities":["apps.manage"],"declaredTopicPermissions":[],"resources":{"baselineCpuWeight":0,"burstCpuWeight":0.05,"baselineMemoryWeight":0.01,"burstMemoryWeight":0.2,"baselineStorageIoWeight":0,"burstStorageIoWeight":0.2,"baselineNetworkIoWeight":0,"burstNetworkIoWeight":0.2},"intents":[],"dependencies":[],"assets":[],"fileHandlers":[],"terminal":{"name":"hackpkg","aliases":[],"usage":"hackpkg install \u003Crepo\u003E[@version] [--user|--system] | remove \u003CappId\u003E [--user|--system] | update [\u003CappId\u003E] | list | info \u003Crepo\u003E | sources [add|remove \u003Csource\u003E] | policy"},"singleInstancePerUser":false,"autoStart":false,"supportsBack":false,"execution":"mainThread"}
