{"schemaVersion":1,"id":"org.hackeros.commands.tail","name":"tail","version":"1.0.0","publisherId":"pub.hackeros","description":"Output the last part of files","kind":"terminal","entryPoint":{"assembly":"HackerOs.Commands.dll","type":"HackerOs.Commands.Tail.TailCommand"},"sdkCompatibility":{"minimumVersion":"2.2.0"},"presentation":{"category":"utilities","launchVisibility":"hidden","iconAssetPaths":[]},"localizations":[{"culture":"fr","resourcePath":"localization/org.hackeros.commands.tail/fr.json"}],"capabilities":["filesystem.system.read","filesystem.user-home.read"],"declaredTopicPermissions":[],"resources":{"baselineCpuWeight":0.01,"burstCpuWeight":0.05,"baselineMemoryWeight":0.01,"burstMemoryWeight":0.05,"baselineStorageIoWeight":0.05,"burstStorageIoWeight":0.2,"baselineNetworkIoWeight":0,"burstNetworkIoWeight":0},"intents":[],"dependencies":[],"assets":[],"fileHandlers":[],"terminal":{"name":"tail","aliases":[],"usage":"tail [-n [\u002B]count | -count] [-c bytes] [-f] [-qv] [file...]"},"singleInstancePerUser":false,"autoStart":false,"supportsBack":false,"execution":"pool"}
