{"schemaVersion":1,"id":"org.hackeros.commands.nmap","name":"nmap","version":"1.0.0","publisherId":"pub.hackeros","description":"Simulated network mapper \u2014 scans ports on simulated hosts","kind":"terminal","entryPoint":{"assembly":"HackerOs.Commands.dll","type":"HackerOs.Commands.Nmap.NmapCommand"},"sdkCompatibility":{"minimumVersion":"2.1.0"},"presentation":{"category":"network","launchVisibility":"hidden","iconAssetPaths":[]},"localizations":[{"culture":"fr","resourcePath":"localization/org.hackeros.commands.nmap/fr.json"}],"capabilities":["network.real.access","network.simulated.read"],"declaredTopicPermissions":[],"resources":{"baselineCpuWeight":0.02,"burstCpuWeight":0.15,"baselineMemoryWeight":0.01,"burstMemoryWeight":0.05,"baselineStorageIoWeight":0,"burstStorageIoWeight":0,"baselineNetworkIoWeight":0,"burstNetworkIoWeight":0},"intents":[],"dependencies":[],"assets":[],"fileHandlers":[],"terminal":{"name":"nmap","aliases":[],"usage":"nmap [-p \u003Crange\u003E] [-sV] [-O] \u003Ctarget\u003E"},"singleInstancePerUser":false,"autoStart":false,"supportsBack":false,"execution":"pool"}
