{"schemaVersion":1,"id":"org.hackeros.commands.wget","name":"wget","version":"1.0.0","publisherId":"pub.hackeros","description":"Download files from the network","kind":"terminal","entryPoint":{"assembly":"HackerOs.Commands.dll","type":"HackerOs.Commands.Wget.WgetCommand"},"sdkCompatibility":{"minimumVersion":"2.1.0"},"presentation":{"category":"utilities","launchVisibility":"hidden","iconAssetPaths":[]},"localizations":[{"culture":"fr","resourcePath":"localization/org.hackeros.commands.wget/fr.json"}],"capabilities":["filesystem.user-home.read","filesystem.user-home.write","network.real.access","network.simulated.read","network.simulated.write"],"declaredTopicPermissions":[],"resources":{"baselineCpuWeight":0.01,"burstCpuWeight":0.08,"baselineMemoryWeight":0.01,"burstMemoryWeight":0.05,"baselineStorageIoWeight":0,"burstStorageIoWeight":0.2,"baselineNetworkIoWeight":0.05,"burstNetworkIoWeight":0.6},"intents":[],"dependencies":[],"assets":[],"fileHandlers":[],"terminal":{"name":"wget","aliases":[],"usage":"wget [-O file] [-P dir] [-q] [-S] [--spider] url..."},"singleInstancePerUser":false,"autoStart":false,"supportsBack":false,"execution":"pool"}
